trace_obfuscate/obf_tmp_file/test_tuner/autotvm_model_4_obf_ga_200.log
{"input": ["cuda -keys=cuda,gpu -max_num_threads=1024 -model=unknown -thread_warp_size=32", "conv2d_nchw_winograd.cuda", [["TENSOR", [1, 3, 32, 32], "float32"], ["TENSOR", [32, 3, 3, 3], "float32"], [1, 1], [1, 1, 1, 1], [1, 1], "float32"], {}], "config": {"index": 6090, "code_hash": null, "entity": [["tile_b", "sp", [-1, 1, 1, 1]], ["tile_y", "sp", [-1, 4, 2, 4]], ["tile_x", "sp", [-1, 4, 16, 1]], ["tile_rc", "sp", [-1, 3]], ["auto_unroll_max_step", "ot", 0], ["unroll_explicit", "ot", 0]]}, "result": [[8.863109084678647e-06], 0, 3.433323383331299, 1614305834.9947774], "version": 0.2, "tvm_version": "0.8.dev0"}
{"input": ["cuda -keys=cuda,gpu -max_num_threads=1024 -model=unknown -thread_warp_size=32", "conv2d_nchw.cuda", [["TENSOR", [1, 3, 32, 32], "float32"], ["TENSOR", [32, 3, 3, 3], "float32"], [1, 1], [1, 1, 1, 1], [1, 1], "float32"], {}], "config": {"index": 6959165, "code_hash": null, "entity": [["tile_f", "sp", [-1, 1, 8, 4]], ["tile_y", "sp", [-1, 1, 2, 1]], ["tile_x", "sp", [-1, 1, 16, 2]], ["tile_rc", "sp", [-1, 3]], ["tile_ry", "sp", [-1, 3]], ["tile_rx", "sp", [-1, 3]], ["auto_unroll_max_step", "ot", 512], ["unroll_explicit", "ot", 1]]}, "result": [[3.42353708630216e-06], 0, 1.6269786357879639, 1614306295.8783584], "version": 0.2, "tvm_version": "0.8.dev0"}
{"input": ["cuda -keys=cuda,gpu -max_num_threads=1024 -model=unknown -thread_warp_size=32", "conv2d_nchw_winograd.cuda", [["TENSOR", [1, 32, 32, 32], "float32"], ["TENSOR", [128, 32, 3, 3], "float32"], [1, 1], [1, 1, 1, 1], [1, 1], "float32"], {}], "config": {"index": 328297, "code_hash": null, "entity": [["tile_b", "sp", [-1, 1, 1, 1]], ["tile_y", "sp", [-1, 1, 8, 8]], ["tile_x", "sp", [-1, 2, 16, 2]], ["tile_rc", "sp", [-1, 4]], ["auto_unroll_max_step", "ot", 1500], ["unroll_explicit", "ot", 1]]}, "result": [[2.0591079629380956e-05], 0, 3.5211985111236572, 1614306610.452348], "version": 0.2, "tvm_version": "0.8.dev0"}
{"input": ["cuda -keys=cuda,gpu -max_num_threads=1024 -model=unknown -thread_warp_size=32", "conv2d_nchw.cuda", [["TENSOR", [1, 32, 32, 32], "float32"], ["TENSOR", [128, 32, 3, 3], "float32"], [1, 1], [1, 1, 1, 1], [1, 1], "float32"], {}], "config": {"index": 16460938, "code_hash": null, "entity": [["tile_f", "sp", [-1, 1, 16, 2]], ["tile_y", "sp", [-1, 1, 4, 2]], ["tile_x", "sp", [-1, 2, 2, 4]], ["tile_rc", "sp", [-1, 2]], ["tile_ry", "sp", [-1, 3]], ["tile_rx", "sp", [-1, 3]], ["auto_unroll_max_step", "ot", 512], ["unroll_explicit", "ot", 0]]}, "result": [[4.90344456350457e-05], 0, 1.3408830165863037, 1614306906.795781], "version": 0.2, "tvm_version": "0.8.dev0"}
{"input": ["cuda -keys=cuda,gpu -max_num_threads=1024 -model=unknown -thread_warp_size=32", "conv2d_nchw_winograd.cuda", [["TENSOR", [1, 128, 16, 16], "float32"], ["TENSOR", [128, 128, 3, 3], "float32"], [1, 1], [1, 1, 1, 1], [1, 1], "float32"], {}], "config": {"index": 188338, "code_hash": null, "entity": [["tile_b", "sp", [-1, 1, 1, 1]], ["tile_y", "sp", [-1, 1, 16, 2]], ["tile_x", "sp", [-1, 2, 2, 4]], ["tile_rc", "sp", [-1, 16]], ["auto_unroll_max_step", "ot", 1500], ["unroll_explicit", "ot", 1]]}, "result": [[2.271424663720215e-05], 0, 3.041525363922119, 1614307227.814437], "version": 0.2, "tvm_version": "0.8.dev0"}
{"input": ["cuda -keys=cuda,gpu -max_num_threads=1024 -model=unknown -thread_warp_size=32", "conv2d_nchw.cuda", [["TENSOR", [1, 128, 16, 16], "float32"], ["TENSOR", [128, 128, 3, 3], "float32"], [1, 1], [1, 1, 1, 1], [1, 1], "float32"], {}], "config": {"index": 27410938, "code_hash": null, "entity": [["tile_f", "sp", [-1, 1, 16, 2]], ["tile_y", "sp", [-1, 1, 16, 1]], ["tile_x", "sp", [-1, 2, 1, 2]], ["tile_rc", "sp", [-1, 4]], ["tile_ry", "sp", [-1, 3]], ["tile_rx", "sp", [-1, 3]], ["auto_unroll_max_step", "ot", 1500], ["unroll_explicit", "ot", 1]]}, "result": [[5.2445479708029196e-05], 0, 1.5610473155975342, 1614307518.364707], "version": 0.2, "tvm_version": "0.8.dev0"}
{"input": ["cuda -keys=cuda,gpu -max_num_threads=1024 -model=unknown -thread_warp_size=32", "conv2d_nchw_winograd.cuda", [["TENSOR", [1, 128, 16, 16], "float32"], ["TENSOR", [256, 128, 3, 3], "float32"], [1, 1], [1, 1, 1, 1], [1, 1], "float32"], {}], "config": {"index": 252409, "code_hash": null, "entity": [["tile_b", "sp", [-1, 1, 1, 1]], ["tile_y", "sp", [-1, 1, 8, 8]], ["tile_x", "sp", [-1, 1, 8, 2]], ["tile_rc", "sp", [-1, 8]], ["auto_unroll_max_step", "ot", 1500], ["unroll_explicit", "ot", 1]]}, "result": [[3.249733771374287e-05], 0, 2.8240966796875, 1614307551.5306094], "version": 0.2, "tvm_version": "0.8.dev0"}
{"input": ["cuda -keys=cuda,gpu -max_num_threads=1024 -model=unknown -thread_warp_size=32", "conv2d_nchw.cuda", [["TENSOR", [1, 128, 16, 16], "float32"], ["TENSOR", [256, 128, 3, 3], "float32"], [1, 1], [1, 1, 1, 1], [1, 1], "float32"], {}], "config": {"index": 37747776, "code_hash": null, "entity": [["tile_f", "sp", [-1, 1, 8, 2]], ["tile_y", "sp", [-1, 1, 16, 1]], ["tile_x", "sp", [-1, 2, 1, 4]], ["tile_rc", "sp", [-1, 4]], ["tile_ry", "sp", [-1, 3]], ["tile_rx", "sp", [-1, 3]], ["auto_unroll_max_step", "ot", 1500], ["unroll_explicit", "ot", 1]]}, "result": [[7.343936933373897e-05], 0, 2.177893877029419, 1614308066.9931853], "version": 0.2, "tvm_version": "0.8.dev0"}
{"input": ["cuda -keys=cuda,gpu -max_num_threads=1024 -model=unknown -thread_warp_size=32", "conv2d_nchw_winograd.cuda", [["TENSOR", [1, 256, 16, 16], "float32"], ["TENSOR", [256, 256, 3, 3], "float32"], [1, 1], [1, 1, 1, 1], [1, 1], "float32"], {}], "config": {"index": 126352, "code_hash": null, "entity": [["tile_b", "sp", [-1, 1, 1, 1]], ["tile_y", "sp", [-1, 1, 16, 8]], ["tile_x", "sp", [-1, 1, 4, 4]], ["tile_rc", "sp", [-1, 8]], ["auto_unroll_max_step", "ot", 1500], ["unroll_explicit", "ot", 0]]}, "result": [[5.19447484939759e-05], 0, 2.9768874645233154, 1614308519.0759647], "version": 0.2, "tvm_version": "0.8.dev0"}
{"input": ["cuda -keys=cuda,gpu -max_num_threads=1024 -model=unknown -thread_warp_size=32", "conv2d_nchw.cuda", [["TENSOR", [1, 256, 16, 16], "float32"], ["TENSOR", [256, 256, 3, 3], "float32"], [1, 1], [1, 1, 1, 1], [1, 1], "float32"], {}], "config": {"index": 42396651, "code_hash": null, "entity": [["tile_f", "sp", [-1, 1, 8, 2]], ["tile_y", "sp", [-1, 1, 16, 1]], ["tile_x", "sp", [-1, 2, 1, 4]], ["tile_rc", "sp", [-1, 4]], ["tile_ry", "sp", [-1, 3]], ["tile_rx", "sp", [-1, 3]], ["auto_unroll_max_step", "ot", 1500], ["unroll_explicit", "ot", 1]]}, "result": [[0.00014106265712240514], 0, 2.0296103954315186, 1614308535.9578354], "version": 0.2, "tvm_version": "0.8.dev0"}
{"input": ["cuda -keys=cuda,gpu -max_num_threads=1024 -model=unknown -thread_warp_size=32", "conv2d_nchw_winograd.cuda", [["TENSOR", [1, 256, 16, 16], "float32"], ["TENSOR", [1024, 256, 3, 3], "float32"], [1, 1], [1, 1, 1, 1], [1, 1], "float32"], {}], "config": {"index": 118882, "code_hash": null, "entity": [["tile_b", "sp", [-1, 1, 1, 1]], ["tile_y", "sp", [-1, 1, 16, 8]], ["tile_x", "sp", [-1, 1, 4, 4]], ["tile_rc", "sp", [-1, 4]], ["auto_unroll_max_step", "ot", 128], ["unroll_explicit", "ot", 0]]}, "result": [[0.0001603883612334802], 0, 2.810002565383911, 1614308952.4921088], "version": 0.2, "tvm_version": "0.8.dev0"}
{"input": ["cuda -keys=cuda,gpu -max_num_threads=1024 -model=unknown -thread_warp_size=32", "conv2d_nchw.cuda", [["TENSOR", [1, 256, 16, 16], "float32"], ["TENSOR", [1024, 256, 3, 3], "float32"], [1, 1], [1, 1, 1, 1], [1, 1], "float32"], {}], "config": {"index": 73490374, "code_hash": null, "entity": [["tile_f", "sp", [-1, 1, 16, 2]], ["tile_y", "sp", [-1, 1, 8, 2]], ["tile_x", "sp", [-1, 2, 1, 4]], ["tile_rc", "sp", [-1, 4]], ["tile_ry", "sp", [-1, 3]], ["tile_rx", "sp", [-1, 3]], ["auto_unroll_max_step", "ot", 1500], ["unroll_explicit", "ot", 1]]}, "result": [[0.0003628620598086124], 0, 2.2944016456604004, 1614309209.357992], "version": 0.2, "tvm_version": "0.8.dev0"}
{"input": ["cuda -keys=cuda,gpu -max_num_threads=1024 -model=unknown -thread_warp_size=32", "conv2d_nchw_winograd.cuda", [["TENSOR", [1, 1024, 16, 16], "float32"], ["TENSOR", [1024, 1024, 3, 3], "float32"], [1, 1], [1, 1, 1, 1], [1, 1], "float32"], {}], "config": {"index": 579342, "code_hash": null, "entity": [["tile_b", "sp", [-1, 1, 1, 1]], ["tile_y", "sp", [-1, 1, 16, 8]], ["tile_x", "sp", [-1, 1, 4, 4]], ["tile_rc", "sp", [-1, 4]], ["auto_unroll_max_step", "ot", 1500], ["unroll_explicit", "ot", 1]]}, "result": [[0.0005507340072202166], 0, 2.800250291824341, 1614309748.8740442], "version": 0.2, "tvm_version": "0.8.dev0"}
{"input": ["cuda -keys=cuda,gpu -max_num_threads=1024 -model=unknown -thread_warp_size=32", "conv2d_nchw.cuda", [["TENSOR", [1, 1024, 16, 16], "float32"], ["TENSOR", [1024, 1024, 3, 3], "float32"], [1, 1], [1, 1, 1, 1], [1, 1], "float32"], {}], "config": {"index": 89606474, "code_hash": null, "entity": [["tile_f", "sp", [-1, 1, 16, 2]], ["tile_y", "sp", [-1, 1, 8, 2]], ["tile_x", "sp", [-1, 2, 1, 4]], ["tile_rc", "sp", [-1, 4]], ["tile_ry", "sp", [-1, 3]], ["tile_rx", "sp", [-1, 3]], ["auto_unroll_max_step", "ot", 1500], ["unroll_explicit", "ot", 1]]}, "result": [[0.001378644099099099], 0, 2.453514814376831, 1614309831.143621], "version": 0.2, "tvm_version": "0.8.dev0"}
{"input": ["cuda -keys=cuda,gpu -max_num_threads=1024 -model=unknown -thread_warp_size=32", "dense_small_batch.cuda", [["TENSOR", [1, 128], "float32"], ["TENSOR", [10, 128], "float32"], null, "float32"], {}], "config": {"index": 3, "code_hash": null, "entity": [["tile_k", "sp", [-1, 8]]]}, "result": [[1.561271548993383e-06], 0, 1.3547275066375732, 1614310064.5748622], "version": 0.2, "tvm_version": "0.8.dev0"}
